Rank;Sourceid;Title;Type;Issn;SJR;SJR Quartile;H index;Total Docs. (2023);Total Docs. (3years);Total Refs.;Total Cites (3years);Citable Docs. (3years);Cites / Doc. (2years);Ref. / Doc.;Country;Region;Publisher;Coverage;Categories;Areas
216;19600166036;"International Journal of Artificial Intelligence";journal;"09740635";0,362;Q3;32;16;69;657;62;68;0,55;41,06;India;Asiatic Region;"Centre for Environment and Socio-Economic Research Publications";"2009-2023";"Artificial Intelligence (Q3)";"Computer Science"
217;21101058819;"Journal of Robotics and Control (JRC)";journal;"27155056, 27155072";0,361;Q3;20;76;232;6109;735;232;3,44;80,38;Indonesia;Asiatic Region;"Department of Electrical Engineering, Universitas Muhammadiyah Yogyakarta";"2020-2023";"Artificial Intelligence (Q3); Control and Systems Engineering (Q3)";"Computer Science; Engineering"
218;21101132923;"Internet Technology Letters";journal;"24761508";0,346;Q3;21;114;203;1718;379;114;1,80;15,07;United Kingdom;Western Europe;"John Wiley and Sons Inc.";"2018-2023";"Artificial Intelligence (Q3); Computer Networks and Communications (Q3); Information Systems (Q3); Software (Q3)";"Computer Science"
219;27190;"Machine Translation";journal;"09226567, 15730573";0,340;Q3;35;0;39;0;107;36;2,27;0,00;Netherlands;Western Europe;"Springer Netherlands";"1989-2021";"Linguistics and Language (Q1); Artificial Intelligence (Q3); Software (Q3)";"Computer Science; Social Sciences"
220;25476;"Intelligent Automation and Soft Computing";journal;"10798587, 2326005X";0,338;Q3;35;666;896;21172;2224;892;2,70;31,79;United States;Northern America;"Tech Science Press";"1995-2023";"Artificial Intelligence (Q3); Computational Theory and Mathematics (Q3); Software (Q3); Theoretical Computer Science (Q4)";"Computer Science; Mathematics"
221;21100390407;"Journal of Biomedical Physics and Engineering";journal;"22517200";0,332;Q3;22;64;247;1842;383;230;1,42;28,78;Iran;Middle East;"Shiraz University of Medical Sciences";"2015-2023";"Artificial Intelligence (Q3); Biomedical Engineering (Q3); Computer Science Applications (Q3); Computer Vision and Pattern Recognition (Q3); Physical Therapy, Sports Therapy and Rehabilitation (Q3); Radiation (Q3); Radiological and Ultrasound Technology (Q3); Radiology, Nuclear Medicine and Imaging (Q3); Bioengineering (Q4)";"Chemical Engineering; Computer Science; Engineering; Health Professions; Medicine; Physics and Astronomy"
222;21101072121;"Journal of Geo-Information Science";journal;"15608999";0,330;Q3;22;177;577;7006;889;577;1,54;39,58;China;Asiatic Region;"Science China Press";"2017-2023";"Artificial Intelligence (Q3); Computer Science Applications (Q3); Computers in Earth Sciences (Q3); Earth and Planetary Sciences (miscellaneous) (Q3); Information Systems (Q3)";"Computer Science; Earth and Planetary Sciences"
223;21101017116;"Journal of Advances in Information Technology";journal;"17982340";0,323;Q3;19;160;175;5252;595;175;3,26;32,83;United States;Northern America;"Engineering and Technology Publishing";"2019-2023";"Artificial Intelligence (Q3); Computer Networks and Communications (Q3); Computer Science Applications (Q3); Information Systems (Q3); Software (Q3)";"Computer Science"
224;21101077110;"Cognitive Computation and Systems";journal;"25177567";0,322;Q3;10;25;90;935;135;88;1,43;37,40;United Kingdom;Western Europe;"John Wiley and Sons Inc.";"2019-2023";"Artificial Intelligence (Q3); Computer Science Applications (Q3); Computer Vision and Pattern Recognition (Q3); Cognitive Neuroscience (Q4); Experimental and Cognitive Psychology (Q4)";"Computer Science; Neuroscience; Psychology"
225;11300153726;"Intelligent Data Analysis";journal;"1088467X, 15714128";0,322;Q3;52;91;253;3618;294;236;1,02;39,76;Netherlands;Western Europe;"IOS Press BV";"1997-2023";"Artificial Intelligence (Q3); Computer Vision and Pattern Recognition (Q3); Theoretical Computer Science (Q4)";"Computer Science; Mathematics"
226;21100863713;"International Journal of Knowledge and Systems Science";journal;"19478216, 19478208";0,317;Q3;11;13;53;613;70;53;0,91;47,15;United States;Northern America;"IGI Global Publishing";"2017-2023";"Artificial Intelligence (Q3); Information Systems (Q3); Information Systems and Management (Q3); Management of Technology and Innovation (Q3); Organizational Behavior and Human Resource Management (Q3); Strategy and Management (Q3)";"Business, Management and Accounting; Computer Science; Decision Sciences"
227;110565;"IEEE International Conference on Fuzzy Systems";conference and proceedings;"10987584";0,316;-;66;139;592;3313;584;586;0,96;23,83;United States;Northern America;"Institute of Electrical and Electronics Engineers Inc.";"1994-2009, 2011-2015, 2017-2022";"Applied Mathematics; Artificial Intelligence; Software; Theoretical Computer Science";"Computer Science; Mathematics"
228;21100890645;"International Journal of Advances in Intelligent Informatics";journal;"25483161, 24426571";0,315;Q3;16;40;86;1617;154;86;1,69;40,43;Indonesia;Asiatic Region;"Universitas Ahmad Dahlan";"2015-2023";"Artificial Intelligence (Q3); Computer Vision and Pattern Recognition (Q3); Human-Computer Interaction (Q4)";"Computer Science"
229;21100832761;"International Journal of Fuzzy Logic and Intelligent Systems";journal;"2093744X, 15982645";0,312;Q3;17;40;120;1255;189;120;1,85;31,38;South Korea;Asiatic Region;"Korean Institute of Intelligent Systems";"2017-2023";"Artificial Intelligence (Q3); Computational Theory and Mathematics (Q3); Computer Science Applications (Q3); Logic (Q3); Signal Processing (Q3)";"Computer Science; Mathematics"
230;21101044836;"Journal of Computer Science and Technology(Argentina)";journal;"16666046, 16666038";0,312;Q3;5;17;34;516;32;32;0,94;30,35;Argentina;Latin America;"Facultad de Informatica, Universidad Nacional de La Plata";"2021-2023";"Artificial Intelligence (Q3); Computer Science Applications (Q3); Computer Science (miscellaneous) (Q3); Computer Vision and Pattern Recognition (Q3); Hardware and Architecture (Q3); Software (Q3)";"Computer Science"
231;18056;"Jiqiren/Robot";journal;"10020446";0,309;Q3;31;51;207;2468;383;207;1,56;48,39;China;Asiatic Region;"Chinese Academy of Sciences";"1998, 2001-2023";"Applied Mathematics (Q3); Artificial Intelligence (Q3); Electrical and Electronic Engineering (Q3); Mechanical Engineering (Q3); Modeling and Simulation (Q3); Software (Q3)";"Computer Science; Engineering; Mathematics"
232;21101041536;"SAE International Journal of Connected and Automated Vehicles";journal;"25740741, 2574075X";0,309;Q3;7;33;95;1277;129;88;1,32;38,70;United States;Northern America;"SAE International";"2019-2023";"Automotive Engineering (Q2); Artificial Intelligence (Q3); Computer Science Applications (Q3); Control and Systems Engineering (Q3)";"Computer Science; Engineering"
233;25507;"Informatica (Slovenia)";journal;"18543871, 03505596";0,308;Q3;39;142;291;4838;453;285;1,47;34,07;Slovenia;Eastern Europe;"Slovene Society Informatika";"1995-2023";"Artificial Intelligence (Q3); Computer Science Applications (Q3); Software (Q3); Theoretical Computer Science (Q4)";"Computer Science; Mathematics"
234;21100864387;"International Journal of Swarm Intelligence Research";journal;"19479263, 19479271";0,307;Q3;11;10;117;349;155;117;1,15;34,90;United States;Northern America;"IGI Global Publishing";"2016-2023";"Artificial Intelligence (Q3); Computational Theory and Mathematics (Q3); Computer Science Applications (Q3)";"Computer Science"
235;21101063739;"Journal of Medical Artificial Intelligence";journal;"26172496";0,307;Q4;8;27;37;1557;47;30;0,95;57,67;Hong Kong;Asiatic Region;"AME Publishing Company";"2018-2023";"Medicine (miscellaneous) (Q3); Artificial Intelligence (Q4)";"Computer Science; Medicine"
236;21100826286;"Fuzzy Information and Engineering";journal;"16168658, 16168666";0,304;Q4;25;23;88;682;152;88;1,72;29,65;United Kingdom;Western Europe;"Tsinghua University Press";"2011, 2014-2023";"Applied Mathematics (Q3); Control and Systems Engineering (Q3); Industrial and Manufacturing Engineering (Q3); Information Systems (Q3); Logic (Q3); Management Science and Operations Research (Q3); Artificial Intelligence (Q4); Theoretical Computer Science (Q4)";"Computer Science; Decision Sciences; Engineering; Mathematics"
237;24310;"International Journal of Pattern Recognition and Artificial Intelligence";journal;"02180014, 17936381";0,302;Q4;62;200;663;7930;921;661;1,20;39,65;Singapore;Asiatic Region;"World Scientific Publishing Co. Pte Ltd";"1995-2023";"Computer Vision and Pattern Recognition (Q3); Software (Q3); Artificial Intelligence (Q4)";"Computer Science"
238;21100255064;"Mendel";journal;"18033814";0,302;Q4;15;32;51;1136;82;51;1,73;35,50;Czech Republic;Eastern Europe;"Brno University of Technology";"2005-2007, 2009-2023";"Computational Mathematics (Q3); Computer Science (miscellaneous) (Q3); Control and Systems Engineering (Q3); Decision Sciences (miscellaneous) (Q3); Artificial Intelligence (Q4); Theoretical Computer Science (Q4)";"Computer Science; Decision Sciences; Engineering; Mathematics"
239;144653;"Artificial Life and Robotics";journal;"14335298";0,301;Q4;24;96;249;1922;269;249;1,22;20,02;Japan;Asiatic Region;"Springer Japan";"1997-1998, 2000, 2005-2023";"Biochemistry, Genetics and Molecular Biology (miscellaneous) (Q3); Artificial Intelligence (Q4)";"Biochemistry, Genetics and Molecular Biology; Computer Science"
240;21100216911;"International Conference Recent Advances in Natural Language Processing, RANLP";conference and proceedings;"13138502";0,299;-;35;150;219;4883;305;215;1,39;32,55;United States;Northern America;"Association for Computational Linguistics (ACL)";"2005-2009, 2011, 2013, 2015, 2017, 2019, 2021";"Artificial Intelligence; Computer Science Applications; Electrical and Electronic Engineering; Software";"Computer Science; Engineering"
241;21101047137;"Springer Proceedings in Advanced Robotics";conference and proceedings;"25111264, 25111256";0,296;-;24;94;637;2657;644;172;0,91;28,27;Switzerland;Western Europe;"";"2017-2023";"Applied Mathematics; Artificial Intelligence; Computer Science Applications; Control and Systems Engineering; Electrical and Electronic Engineering; Engineering (miscellaneous); Mechanical Engineering";"Computer Science; Engineering; Mathematics"
242;4700152645;"International Journal on Artificial Intelligence Tools";journal;"02182130, 17936349";0,288;Q4;39;83;179;3468;248;169;1,33;41,78;Singapore;Asiatic Region;"World Scientific";"2005-2023";"Artificial Intelligence (Q4)";"Computer Science"
243;79015;"Kongzhi yu Juece/Control and Decision";journal;"10010920";0,288;Q4;52;371;1066;12711;1536;1066;1,58;34,26;China;Asiatic Region;"Northeast University";"1997-2023";"Control and Optimization (Q3); Control and Systems Engineering (Q3); Artificial Intelligence (Q4); Software (Q4)";"Computer Science; Engineering; Mathematics"
244;21101060452;"Vietnam Journal of Computer Science";journal;"21968896";0,285;Q4;9;30;78;1273;116;78;1,38;42,43;Singapore;Asiatic Region;"World Scientific";"2019-2023";"Computational Theory and Mathematics (Q3); Computer Science (miscellaneous) (Q3); Computer Vision and Pattern Recognition (Q3); Information Systems (Q3); Artificial Intelligence (Q4); Software (Q4)";"Computer Science"
245;13427;"Bulletin of the Polish Academy of Sciences: Technical Sciences";journal;"23001917, 02397528";0,282;Q4;49;99;467;3094;587;463;1,30;31,25;Poland;Eastern Europe;"Polish Academy of Sciences";"1983-1988, 2004-2023";"Atomic and Molecular Physics, and Optics (Q3); Computer Networks and Communications (Q3); Engineering (miscellaneous) (Q3); Information Systems (Q3); Artificial Intelligence (Q4)";"Computer Science; Engineering; Physics and Astronomy"
246;19500157321;"Frontiers in Artificial Intelligence and Applications";book series;"09226389, 18798314";0,281;Q4;64;1234;1881;31433;1640;1740;0,59;25,47;Netherlands;Western Europe;"IOS Press BV";"2004-2023";"Artificial Intelligence (Q4)";"Computer Science"
247;21101170609;"Complex Systems Informatics and Modeling Quarterly";journal;"22559922";0,280;Q4;9;20;61;1060;76;53;1,49;53,00;Latvia;Eastern Europe;"Riga Technical University";"2019-2023";"Business, Management and Accounting (miscellaneous) (Q3); Engineering (miscellaneous) (Q3); Information Systems (Q3); Artificial Intelligence (Q4)";"Business, Management and Accounting; Computer Science; Engineering"
248;24847;"Revue d'Intelligence Artificielle";journal;"0992499X";0,278;Q4;22;180;269;5741;536;269;1,83;31,89;France;Western Europe;"Lavoisier";"1995-2023";"Artificial Intelligence (Q4); Software (Q4)";"Computer Science"
249;15109;"IEICE Transactions on Information and Systems";journal;"17451361, 09168532";0,277;Q4;55;220;845;5579;725;811;0,78;25,36;Japan;Asiatic Region;"Maruzen Co., Ltd/Maruzen Kabushikikaisha";"1993-2023";"Computer Vision and Pattern Recognition (Q3); Electrical and Electronic Engineering (Q3); Hardware and Architecture (Q3); Artificial Intelligence (Q4); Software (Q4)";"Computer Science; Engineering"
250;21101083166;"Proceedings of the International Symposium on Automation and Robotics in Construction";conference and proceedings;"24135844";0,277;-;6;102;230;2298;186;226;0,81;22,53;Finland;Western Europe;"International Association for Automation and Robotics in Construction (IAARC)";"2021-2023";"Artificial Intelligence; Building and Construction; Civil and Structural Engineering; Computer Science Applications; Control and Systems Engineering; Safety, Risk, Reliability and Quality";"Computer Science; Engineering"
251;24449;"Kybernetika";journal;"00235954, 1805949X";0,275;Q4;41;39;162;1192;132;156;0,87;30,56;Czech Republic;Eastern Europe;"Academy of Sciences of the Czech Republic";"1972-1989, 1996-2023";"Control and Systems Engineering (Q3); Electrical and Electronic Engineering (Q3); Information Systems (Q3); Artificial Intelligence (Q4); Software (Q4); Theoretical Computer Science (Q4)";"Computer Science; Engineering; Mathematics"
252;19900193685;"International Journal of Knowledge-Based and Intelligent Engineering Systems";journal;"13272314, 18758827";0,267;Q4;23;37;85;2174;121;85;1,56;58,76;Netherlands;Western Europe;"IOS Press BV";"2004-2023";"Control and Systems Engineering (Q3); Artificial Intelligence (Q4); Software (Q4)";"Computer Science; Engineering"
253;21100211724;"Intelligent Decision Technologies";journal;"18724981, 18758843";0,266;Q4;19;84;172;3718;211;163;1,00;44,26;Netherlands;Western Europe;"IOS Press BV";"2007-2023";"Computer Vision and Pattern Recognition (Q3); Artificial Intelligence (Q4); Human-Computer Interaction (Q4); Software (Q4); Statistics and Probability (Q4); Statistics, Probability and Uncertainty (Q4)";"Computer Science; Decision Sciences; Mathematics"
254;21100818722;"Cybernetics and Physics";journal;"22237038, 22264116";0,265;Q4;12;35;92;927;91;92;1,01;26,49;Russian Federation;Eastern Europe;"Institute of Problems of Mechanical Engineering, Russian Academy of Sciences";"2016-2023";"Computer Vision and Pattern Recognition (Q3); Control and Optimization (Q3); Fluid Flow and Transfer Processes (Q3); Physics and Astronomy (miscellaneous) (Q3); Artificial Intelligence (Q4); Signal Processing (Q4)";"Chemical Engineering; Computer Science; Mathematics; Physics and Astronomy"
255;21100788860;"International Journal of Mechanical Engineering and Robotics Research";journal;"22780149";0,263;Q4;19;52;466;1338;583;466;1,36;25,73;India;Asiatic Region;"International Journal of Mechanical Engineering and Robotics Research";"2016-2023";"Control and Systems Engineering (Q3); Mechanical Engineering (Q3); Artificial Intelligence (Q4)";"Computer Science; Engineering"
256;21100783205;"Horizon. Studies in Phenomenology";journal;"23116986, 22265260";0,258;Q4;4;29;96;893;27;93;0,23;30,79;Russian Federation;Eastern Europe;"Saint Petersburg State University";"2012-2023";"Philosophy (Q2); Control and Systems Engineering (Q3); Electrical and Electronic Engineering (Q3); Energy Engineering and Power Technology (Q3); Artificial Intelligence (Q4); Control and Optimization (Q4); Signal Processing (Q4)";"Arts and Humanities; Computer Science; Energy; Engineering; Mathematics"
257;21100872796;"International Journal of Semantic Computing";journal;"17937108, 1793351X";0,258;Q4;20;35;85;1290;64;73;0,51;36,86;Singapore;Asiatic Region;"World Scientific";"2007-2023";"Linguistics and Language (Q2); Computer Networks and Communications (Q3); Information Systems (Q3); Artificial Intelligence (Q4); Computer Science Applications (Q4); Software (Q4)";"Computer Science; Social Sciences"
258;11600154611;"ACM International Conference Proceeding Series";conference and proceedings;"-";0,253;-;151;519;35675;13970;23024;34023;0,58;26,92;United States;Northern America;"Association for Computing Machinery (ACM)";"1993, 1996-1997, 1999-2023";"Artificial Intelligence; Computer Networks and Communications; Computer Vision and Pattern Recognition; Human-Computer Interaction; Software";"Computer Science"
259;19270;"International Journal of Software Engineering and Knowledge Engineering";journal;"17936403, 02181940";0,251;Q4;41;84;224;3473;224;213;0,94;41,35;Singapore;Asiatic Region;"World Scientific Publishing Co. Pte Ltd";"1996-2023";"Computer Graphics and Computer-Aided Design (Q3); Computer Networks and Communications (Q3); Artificial Intelligence (Q4); Software (Q4)";"Computer Science"
260;24802;"Neural Network World";journal;"23364335, 12100552";0,251;Q4;30;25;62;766;84;62;1,24;30,64;Czech Republic;Eastern Europe;"Czech Technical University in Prague";"1994-2023";"Artificial Intelligence (Q4); Hardware and Architecture (Q4); Neuroscience (miscellaneous) (Q4); Software (Q4)";"Computer Science; Neuroscience"
261;21101023180;"International Journal of Advanced Technology and Engineering Exploration";journal;"23945443, 23947454";0,240;Q4;10;97;264;5071;332;264;1,32;52,28;India;Asiatic Region;"Accent Social and Welfare Society";"2019-2023";"Civil and Structural Engineering (Q3); Computer Graphics and Computer-Aided Design (Q3); Computer Networks and Communications (Q3); Electrical and Electronic Engineering (Q3); Mechanical Engineering (Q3); Artificial Intelligence (Q4); Computational Theory and Mathematics (Q4); Control and Systems Engineering (Q4)";"Computer Science; Engineering"
262;21101044727;"Informatics and Automation";journal;"27133206, 27133192";0,239;Q4;13;50;139;2182;123;139;1,10;43,64;Russian Federation;Eastern Europe;"St. Petersburg Federal Research Center of the  Russian Academy of Sciences";"2020-2023";"Applied Mathematics (Q4); Artificial Intelligence (Q4); Computational Mathematics (Q4); Computational Theory and Mathematics (Q4); Computer Networks and Communications (Q4); Information Systems (Q4)";"Computer Science; Mathematics"
263;19700166503;"Journal of Advanced Computational Intelligence and Intelligent Informatics";journal;"13430130, 18838014";0,239;Q4;32;134;297;3439;284;296;1,03;25,66;Japan;Asiatic Region;"Fuji Technology Press";"1997-2023";"Artificial Intelligence (Q4); Computer Vision and Pattern Recognition (Q4); Human-Computer Interaction (Q4)";"Computer Science"
264;19900191975;"Journal of Uncertain Systems";journal;"17528917, 17528909";0,238;Q4;21;35;59;1023;78;58;1,32;29,23;Singapore;Asiatic Region;"World Scientific";"2011-2019, 2021-2023";"Artificial Intelligence (Q4); Computer Vision and Pattern Recognition (Q4); Control and Optimization (Q4)";"Computer Science; Mathematics"
265;21101037310;"Register: Jurnal Ilmiah Teknologi Sistem Informasi";journal;"25023357, 25030477";0,236;Q4;7;14;41;586;75;41;1,89;41,86;Indonesia;Asiatic Region;"Universitas Pesantren Tinggi Darul Ulum";"2015-2023";"Computer Science (miscellaneous) (Q3); Information Systems and Management (Q3); Artificial Intelligence (Q4); Decision Sciences (miscellaneous) (Q4); Information Systems (Q4)";"Computer Science; Decision Sciences"
266;21101000293;"Mekhatronika, Avtomatizatsiya, Upravlenie";journal;"16846427, 26191253";0,235;Q4;6;71;226;1508;116;226;0,50;21,24;Russian Federation;Eastern Europe;"New Technologies Publishing House";"2019-2023";"Electrical and Electronic Engineering (Q3); Artificial Intelligence (Q4); Computer Science Applications (Q4); Control and Systems Engineering (Q4); Human-Computer Interaction (Q4); Software (Q4)";"Computer Science; Engineering"
267;21101093016;"Chinese Journal of Intelligent Science and Technology";journal;"20966652";0,230;Q4;13;37;153;1766;141;151;0,86;47,73;China;Asiatic Region;"Beijing Xintong Media Co., Ltd.";"2019-2023";"Computer Science (miscellaneous) (Q3); Artificial Intelligence (Q4); Computer Science Applications (Q4)";"Computer Science"
268;19700186872;"International Journal of Cognitive Informatics and Natural Intelligence";journal;"15573958, 15573966";0,226;Q4;28;8;117;202;102;117;0,87;25,25;United States;Northern America;"IGI Global Publishing";"2007-2023";"Artificial Intelligence (Q4); Human-Computer Interaction (Q4); Software (Q4)";"Computer Science"
269;21101038721;"Data Analysis and Knowledge Discovery";journal;"20963467";0,219;Q4;9;140;441;5176;340;441;0,81;36,97;China;Asiatic Region;"Chinese Academy of Sciences";"2019-2023";"Library and Information Sciences (Q3); Artificial Intelligence (Q4); Computer Science Applications (Q4); Information Systems (Q4)";"Computer Science; Social Sciences"
270;21101170296;"CAAI Transactions on Intelligent Systems";journal;"16734785";0,218;Q4;12;108;394;3478;343;389;0,81;32,20;China;Asiatic Region;"";"2019-2023";"Artificial Intelligence (Q4); Computer Vision and Pattern Recognition (Q4); Control and Systems Engineering (Q4)";"Computer Science; Engineering"
271;24258;"Inteligencia Artificial";journal;"11373601";0,218;Q4;14;23;61;815;79;61;1,15;35,43;Spain;Western Europe;"Asociacion Espanola de Inteligencia Artificial";"2004-2010, 2012-2023";"Artificial Intelligence (Q4); Software (Q4)";"Computer Science"
272;25482;"International Journal of Robotics and Automation";journal;"19257090, 08268185";0,217;Q4;29;46;161;1389;119;158;0,73;30,20;Canada;Northern America;"Acta Press";"1995-2023";"Electrical and Electronic Engineering (Q3); Artificial Intelligence (Q4); Control and Systems Engineering (Q4); Mechanical Engineering (Q4); Modeling and Simulation (Q4); Software (Q4)";"Computer Science; Engineering; Mathematics"
273;21100890383;"International Journal of Computing and Digital Systems";journal;"2210142X";0,215;Q4;16;202;464;8155;478;464;1,08;40,37;Bahrain;Middle East;"University of Bahrain";"2012-2023";"Computer Graphics and Computer-Aided Design (Q3); Artificial Intelligence (Q4); Computer Networks and Communications (Q4); Human-Computer Interaction (Q4); Information Systems (Q4); Management of Technology and Innovation (Q4)";"Business, Management and Accounting; Computer Science"
274;21101085281;"Art, Science, and Engineering of Programming";journal;"24737321";0,212;Q4;10;21;46;1090;33;46;0,60;51,90;United States;Northern America;"AOSA Inc.";"2017-2023";"Artificial Intelligence (Q4); Computational Theory and Mathematics (Q4); Modeling and Simulation (Q4); Software (Q4); Theoretical Computer Science (Q4)";"Computer Science; Mathematics"
275;21101021717;"Journal of Image and Graphics";journal;"10068961";0,212;Q4;15;224;670;11723;998;670;1,66;52,33;China;Asiatic Region;"Editorial and Publishing Board of JIG";"2020-2023";"Computer Graphics and Computer-Aided Design (Q3); Artificial Intelligence (Q4); Computer Vision and Pattern Recognition (Q4); Human-Computer Interaction (Q4)";"Computer Science"
276;21101021990;"International Journal of Intelligent Systems and Applications in Engineering";journal;"21476799";0,209;Q4;16;1025;401;29554;456;401;1,03;28,83;Turkey;Middle East;"Auricle Global Society of Education and Research";"2020-2024";"Artificial Intelligence (Q4); Computer Graphics and Computer-Aided Design (Q4); Control and Systems Engineering (Q4); Information Systems (Q4)";"Computer Science; Engineering"
277;21100826268;"Computer Science";journal;"23007036, 15082806";0,208;Q4;10;24;72;1062;63;72;0,71;44,25;Poland;Eastern Europe;"AGH University of Science and Technology";"2017-2023";"Artificial Intelligence (Q4); Computational Theory and Mathematics (Q4); Computer Graphics and Computer-Aided Design (Q4); Computer Networks and Communications (Q4); Computer Science (miscellaneous) (Q4); Computer Vision and Pattern Recognition (Q4); Modeling and Simulation (Q4)";"Computer Science; Mathematics"
278;21101067491;"Journal of Medical Robotics Research";journal;"24249068, 2424905X";0,208;Q4;16;15;31;542;34;31;1,19;36,13;Singapore;Asiatic Region;"World Scientific";"2016-2023";"Applied Mathematics (Q4); Artificial Intelligence (Q4); Biomedical Engineering (Q4); Computer Science Applications (Q4); Human-Computer Interaction (Q4)";"Computer Science; Engineering; Mathematics"
279;4900152708;"Studies in Computational Intelligence";book series;"18609503, 1860949X";0,208;Q4;87;1526;4620;49279;4416;1451;0,93;32,29;Germany;Western Europe;"Springer Verlag";"2006-2023";"Artificial Intelligence (Q4)";"Computer Science"
280;11700154336;"Journal of Computer Science";journal;"15493636";0,204;Q4;36;120;353;4464;362;353;1,12;37,20;United States;Northern America;"Science Publications";"2008-2023";"Artificial Intelligence (Q4); Computer Networks and Communications (Q4); Software (Q4)";"Computer Science"
281;21100440516;"International Journal of Computer Information Systems and Industrial Management Applications";journal;"21507988";0,203;Q4;11;50;101;1957;126;101;0,66;39,14;United States;Northern America;"Machine Intelligence Research Labs";"2015-2023";"Artificial Intelligence (Q4); Computer Vision and Pattern Recognition (Q4); Information Systems (Q4); Management Information Systems (Q4); Signal Processing (Q4); Strategy and Management (Q4)";"Business, Management and Accounting; Computer Science"
