Rank;Sourceid;Title;Type;Issn;SJR;SJR Quartile;H index;Total Docs. (2023);Total Docs. (3years);Total Refs.;Total Cites (3years);Citable Docs. (3years);Cites / Doc. (2years);Ref. / Doc.;Country;Region;Publisher;Coverage;Categories;Areas
74;21101068929;"Smart Cities";journal;"26246511";1,326;Q1;32;152;239;11445;2147;234;10,13;75,30;Switzerland;Western Europe;"Multidisciplinary Digital Publishing Institute (MDPI)";"2018-2023";"Artificial Intelligence (Q1); Electrical and Electronic Engineering (Q1); Urban Studies (Q1)";"Computer Science; Engineering; Social Sciences"
75;21100970248;"CAAI Transactions on Intelligence Technology";journal;"24686557, 24682322";1,322;Q1;34;158;144;7974;1158;139;8,89;50,47;United Kingdom;Western Europe;"John Wiley &amp; Sons Inc.";"2017-2023";"Artificial Intelligence (Q1); Computer Networks and Communications (Q1); Computer Vision and Pattern Recognition (Q1); Human-Computer Interaction (Q1); Information Systems (Q1)";"Computer Science"
76;21101095931;"Complex and Intelligent Systems";journal;"21994536, 21986053";1,321;Q1;46;495;571;24360;4311;561;7,34;49,21;Switzerland;Western Europe;"Springer International Publishing AG";"2019-2023";"Artificial Intelligence (Q1); Computational Mathematics (Q1); Engineering (miscellaneous) (Q1); Information Systems (Q1)";"Computer Science; Engineering; Mathematics"
77;21100784665;"IEEE Transactions on Cognitive and Developmental Systems";journal;"23798920, 23798939";1,302;Q1;55;270;315;10091;1484;306;4,82;37,37;United States;Northern America;"Institute of Electrical and Electronics Engineers Inc.";"2016-2023";"Artificial Intelligence (Q1); Software (Q1)";"Computer Science"
78;24305;"International Journal of Intelligent Systems";journal;"1098111X, 08848173";1,264;Q1;106;179;848;9718;5227;846;5,81;54,29;United Kingdom;Western Europe;"Wiley-Hindawi";"1986-2023";"Artificial Intelligence (Q1); Human-Computer Interaction (Q1); Software (Q1); Theoretical Computer Science (Q1)";"Computer Science; Mathematics"
79;24800;"Neural Computing and Applications";journal;"09410643, 14333058";1,256;Q2;130;1527;3515;75143;23116;3464;6,08;49,21;United Kingdom;Western Europe;"Springer London";"1993-2023";"Software (Q1); Artificial Intelligence (Q2)";"Computer Science"
80;21100803572;"Systems Science and Control Engineering";journal;"21642583";1,248;Q2;33;42;247;1348;1524;245;3,38;32,10;United Kingdom;Western Europe;"Taylor and Francis Ltd.";"2013-2023";"Control and Optimization (Q1); Control and Systems Engineering (Q1); Artificial Intelligence (Q2)";"Computer Science; Engineering; Mathematics"
81;23674;"Applied Intelligence";journal;"0924669X, 15737497";1,193;Q2;95;1737;1854;84196;11420;1847;6,27;48,47;Netherlands;Western Europe;"Springer Netherlands";"1991-2023";"Artificial Intelligence (Q2)";"Computer Science"
82;25621;"Journal of Parallel and Distributed Computing";journal;"07437315, 10960848";1,187;Q2;104;125;500;5699;2587;490;4,74;45,59;United States;Northern America;"Academic Press Inc.";"1984-2024";"Computer Networks and Communications (Q1); Hardware and Architecture (Q1); Software (Q1); Theoretical Computer Science (Q1); Artificial Intelligence (Q2)";"Computer Science; Mathematics"
83;18197;"Integrated Computer-Aided Engineering";journal;"10692509, 18758835";1,186;Q2;49;20;81;1251;414;71;5,10;62,55;Netherlands;Western Europe;"IOS Press BV";"1993-2023";"Computational Theory and Mathematics (Q1); Computer Science Applications (Q1); Software (Q1); Theoretical Computer Science (Q1); Artificial Intelligence (Q2)";"Computer Science; Mathematics"
84;36450;"Design Studies";journal;"0142694X";1,180;Q2;111;34;99;2193;482;96;4,53;64,50;United Kingdom;Western Europe;"Elsevier Ltd";"1979-2023";"Architecture (Q1); Arts and Humanities (miscellaneous) (Q1); Computer Science Applications (Q1); Engineering (miscellaneous) (Q1); Social Sciences (miscellaneous) (Q1); Artificial Intelligence (Q2)";"Arts and Humanities; Computer Science; Engineering; Social Sciences"
85;21100285028;"IEEE Transactions on Human-Machine Systems";journal;"21682291";1,139;Q2;138;102;250;4867;1255;250;4,45;47,72;United States;Northern America;"IEEE Systems, Man, and Cybernetics Society";"2013-2023";"Computer Networks and Communications (Q1); Computer Science Applications (Q1); Control and Systems Engineering (Q1); Human Factors and Ergonomics (Q1); Human-Computer Interaction (Q1); Artificial Intelligence (Q2); Signal Processing (Q2)";"Computer Science; Engineering; Social Sciences"
86;21101019779;"Cybersecurity";journal;"20964862, 25233246";1,136;Q2;20;57;90;2447;540;90;5,71;42,93;United Kingdom;Western Europe;"SpringerOpen";"2018-2023";"Computer Networks and Communications (Q1); Information Systems (Q1); Software (Q1); Artificial Intelligence (Q2)";"Computer Science"
87;21101136681;"Internet of Things and Cyber-Physical Systems";journal;"26673452";1,136;Q2;12;24;25;2253;246;25;9,84;93,88;China;Asiatic Region;"KeAi Communications Co.";"2021-2024";"Computer Networks and Communications (Q1); Computer Science Applications (Q1); Electrical and Electronic Engineering (Q1); Artificial Intelligence (Q2)";"Computer Science; Engineering"
88;21100836194;"ICT Express";journal;"24059595";1,133;Q2;44;186;257;5268;1828;257;6,28;28,32;South Korea;Asiatic Region;"Korean Institute of Communications and Information Sciences";"2015-2023";"Computer Networks and Communications (Q1); Hardware and Architecture (Q1); Information Systems (Q1); Software (Q1); Artificial Intelligence (Q2)";"Computer Science"
89;26803;"Journal of Pragmatics";journal;"03782166";1,105;Q2;120;158;605;9559;1513;572;2,28;60,50;Netherlands;Western Europe;"Elsevier B.V.";"1977-2023";"Linguistics and Language (Q1); Artificial Intelligence (Q2)";"Computer Science; Social Sciences"
90;21101060161;"IEEE Transactions on Medical Robotics and Bionics";journal;"25763202";1,102;Q2;23;94;280;5192;1144;273;3,82;55,23;United States;Northern America;"Institute of Electrical and Electronics Engineers Inc.";"2019-2023";"Biomedical Engineering (Q1); Computer Science Applications (Q1); Control and Optimization (Q1); Human-Computer Interaction (Q1); Artificial Intelligence (Q2)";"Computer Science; Engineering; Mathematics"
91;21101170600;"Psychoradiology";journal;"26344416";1,093;Q2;4;31;21;2444;83;20;3,95;78,84;United Kingdom;Western Europe;"Oxford University Press";"2021-2023";"Clinical Psychology (Q1); Neurology (clinical) (Q1); Psychology (miscellaneous) (Q1); Radiology, Nuclear Medicine and Imaging (Q1); Artificial Intelligence (Q2); Neuroscience (miscellaneous) (Q2); Psychiatry and Mental Health (Q2)";"Computer Science; Medicine; Neuroscience; Psychology"
92;12874;"Cognitive Science";journal;"03640213, 15516709";1,082;Q2;136;162;370;10643;1030;353;2,59;65,70;United States;Northern America;"Wiley-Blackwell";"1977-2023";"Experimental and Cognitive Psychology (Q1); Artificial Intelligence (Q2); Cognitive Neuroscience (Q2)";"Computer Science; Neuroscience; Psychology"
93;21101107952;"Cognitive Robotics";journal;"26672413";1,075;Q2;11;22;46;1513;289;45;6,28;68,77;China;Asiatic Region;"KeAi Communications Co.";"2021-2023";"Control and Systems Engineering (Q1); Artificial Intelligence (Q2)";"Computer Science; Engineering"
94;19900191735;"Topics in Cognitive Science";journal;"17568765, 17568757";1,068;Q2;73;85;184;6385;527;156;2,61;75,12;United States;Northern America;"Wiley-Blackwell";"2009-2023";"Experimental and Cognitive Psychology (Q1); Linguistics and Language (Q1); Artificial Intelligence (Q2); Cognitive Neuroscience (Q2); Human-Computer Interaction (Q2)";"Computer Science; Neuroscience; Psychology; Social Sciences"
95;21101054787;"Quantum Machine Intelligence";journal;"25244914, 25244906";1,025;Q2;18;46;74;2701;421;74;5,24;58,72;Germany;Western Europe;"Springer Science and Business Media Deutschland GmbH";"2019-2023";"Applied Mathematics (Q1); Computational Theory and Mathematics (Q1); Theoretical Computer Science (Q1); Artificial Intelligence (Q2); Software (Q2)";"Computer Science; Mathematics"
96;26529;"Fuzzy Sets and Systems";journal;"01650114";1,009;Q2;187;314;740;11529;2519;731;3,25;36,72;Netherlands;Western Europe;"Elsevier B.V.";"1978-2024";"Logic (Q1); Artificial Intelligence (Q2)";"Computer Science; Mathematics"
97;21100792090;"Journal of Artificial Intelligence and Soft Computing Research";journal;"24496499, 20832567";1,003;Q2;28;25;60;1145;218;60;3,73;45,80;Poland;Eastern Europe;"De Gruyter Open Ltd.";"2013-2023";"Computer Vision and Pattern Recognition (Q1); Hardware and Architecture (Q1); Information Systems (Q1); Modeling and Simulation (Q1); Artificial Intelligence (Q2)";"Computer Science; Mathematics"
98;21101101955;"International Journal of Intelligent Networks";journal;"26666030";1,001;Q2;19;39;66;1249;682;64;12,58;32,03;China;Asiatic Region;"KeAi Communications Co.";"2020-2023";"Computer Networks and Communications (Q1); Electrical and Electronic Engineering (Q1); Artificial Intelligence (Q2); Signal Processing (Q2)";"Computer Science; Engineering"
99;21100301601;"ACM Transactions on Interactive Intelligent Systems";journal;"21606463, 21606455";0,991;Q2;45;31;91;2831;502;85;4,82;91,32;United States;Northern America;"Association for Computing Machinery (ACM)";"2011-2023";"Artificial Intelligence (Q2); Human-Computer Interaction (Q2)";"Computer Science"
100;19700177336;"International Journal of Machine Learning and Cybernetics";journal;"1868808X, 18688071";0,988;Q2;65;321;648;15430;3059;643;4,05;48,07;United States;Northern America;"Springer Science + Business Media";"2010-2023";"Computer Vision and Pattern Recognition (Q1); Artificial Intelligence (Q2); Software (Q2)";"Computer Science"
101;21101109601;"Machine Learning and Knowledge Extraction";journal;"25044990";0,977;Q2;27;94;142;5409;759;141;5,79;57,54;Switzerland;Western Europe;"Multidisciplinary Digital Publishing Institute (MDPI)";"2019-2023";"Engineering (miscellaneous) (Q1); Artificial Intelligence (Q2)";"Computer Science; Engineering"
102;23616;"AI and Society";journal;"09515666, 14355655";0,976;Q2;45;380;430;19687;2058;385;4,15;51,81;United Kingdom;Western Europe;"Springer London";"1987-1996, 1998-2023";"Philosophy (Q1); Artificial Intelligence (Q2); Human-Computer Interaction (Q2)";"Arts and Humanities; Computer Science"
103;24360;"Journal of Intelligent and Robotic Systems: Theory and Applications";journal;"15730409, 09210296";0,960;Q2;96;239;747;10809;3033;709;3,75;45,23;Netherlands;Western Europe;"";"1988-2023";"Electrical and Electronic Engineering (Q1); Industrial and Manufacturing Engineering (Q1); Mechanical Engineering (Q1); Artificial Intelligence (Q2); Control and Systems Engineering (Q2); Software (Q2)";"Computer Science; Engineering"
104;21101051831;"Intelligent Systems with Applications";journal;"26673053";0,959;Q2;18;139;113;7413;744;113;5,81;53,33;Netherlands;Western Europe;"Elsevier B.V.";"2021-2023";"Computer Science Applications (Q1); Computer Science (miscellaneous) (Q1); Computer Vision and Pattern Recognition (Q1); Artificial Intelligence (Q2); Signal Processing (Q2)";"Computer Science"
105;12886;"Cognitive Systems Research";journal;"13890417, 22144366";0,957;Q2;69;68;175;4029;812;172;3,11;59,25;Netherlands;Western Europe;"Elsevier B.V.";"1999-2024";"Artificial Intelligence (Q2); Cognitive Neuroscience (Q2); Experimental and Cognitive Psychology (Q2); Software (Q2)";"Computer Science; Neuroscience; Psychology"
106;28424;"Theory and Practice of Logic Programming";journal;"14753081, 14710684";0,950;Q2;50;33;134;1015;256;126;1,73;30,76;United Kingdom;Western Europe;"Cambridge University Press";"2001-2023";"Computational Theory and Mathematics (Q1); Artificial Intelligence (Q2); Hardware and Architecture (Q2); Software (Q2); Theoretical Computer Science (Q2)";"Computer Science; Mathematics"
107;21101107176;"Artificial Intelligence in Geosciences";journal;"26665441";0,907;Q2;9;20;47;830;151;46;3,15;41,50;China;Asiatic Region;"KeAi Communications Co.";"2020-2023";"Computers in Earth Sciences (Q1); Earth and Planetary Sciences (miscellaneous) (Q1); Artificial Intelligence (Q2); Control and Systems Engineering (Q2)";"Computer Science; Earth and Planetary Sciences; Engineering"
108;21101049065;"International Journal of Interactive Multimedia and Artificial Intelligence";journal;"19891660";0,904;Q2;23;63;194;2654;706;180;3,37;42,13;Spain;Western Europe;"Universidad Internacional de la Rioja";"2019-2023";"Statistics and Probability (Q1); Artificial Intelligence (Q2); Computer Networks and Communications (Q2); Computer Science Applications (Q2); Computer Vision and Pattern Recognition (Q2); Signal Processing (Q2)";"Computer Science; Mathematics"
109;24286;"International Journal of Approximate Reasoning";journal;"0888613X, 18734731";0,877;Q2;112;175;412;8399;1662;402;3,76;47,99;United States;Northern America;"Elsevier Inc.";"1974, 1987-2023";"Applied Mathematics (Q1); Artificial Intelligence (Q2); Software (Q2); Theoretical Computer Science (Q2)";"Computer Science; Mathematics"
110;21100901156;"Journal of Reliable Intelligent Environments";journal;"21994668, 21994676";0,874;Q2;23;35;75;1836;340;63;5,02;52,46;Switzerland;Western Europe;"Springer International Publishing AG";"2015-2023";"Computer Science (miscellaneous) (Q1); Artificial Intelligence (Q2); Computer Networks and Communications (Q2); Computer Science Applications (Q2); Renewable Energy, Sustainability and the Environment (Q2)";"Computer Science; Energy"
111;24354;"Journal of Automated Reasoning";journal;"15730670, 01687433";0,873;Q2;62;40;125;1534;213;116;1,60;38,35;Netherlands;Western Europe;"Springer Netherlands";"1985-2023";"Artificial Intelligence (Q2); Computational Theory and Mathematics (Q2); Software (Q2)";"Computer Science"
112;21101039622;"Engineered Science";journal;"2576988X, 25769898";0,870;Q2;49;123;238;6514;1849;235;7,67;52,96;United States;Northern America;"Engineered Science Publisher";"2018-2023";"Applied Mathematics (Q1); Chemistry (miscellaneous) (Q1); Engineering (miscellaneous) (Q1); Materials Science (miscellaneous) (Q1); Physical and Theoretical Chemistry (Q1); Artificial Intelligence (Q2); Energy Engineering and Power Technology (Q2)";"Chemistry; Computer Science; Energy; Engineering; Materials Science; Mathematics"
113;15703;"Knowledge and Information Systems";journal;"02191377, 02193116";0,860;Q2;92;197;401;11081;1465;401;3,67;56,25;United Kingdom;Western Europe;"Springer London";"1999-2023";"Information Systems (Q1); Artificial Intelligence (Q2); Hardware and Architecture (Q2); Human-Computer Interaction (Q2); Software (Q2)";"Computer Science"
114;24157;"Autonomous Agents and Multi-Agent Systems";journal;"15737454, 13872532";0,855;Q2;80;47;154;2461;525;150;3,52;52,36;Netherlands;Western Europe;"Springer Netherlands";"1998-2023";"Artificial Intelligence (Q2)";"Computer Science"
115;21101081506;"Journal of Financial Data Science";journal;"26403951, 26403943";0,854;Q2;13;35;106;980;267;103;2,17;28,00;United Kingdom;Western Europe;"With intelligence";"2019-2023";"Business and International Management (Q1); Business, Management and Accounting (miscellaneous) (Q1); Artificial Intelligence (Q2); Computational Theory and Mathematics (Q2); Finance (Q2); Information Systems (Q2); Information Systems and Management (Q2); Strategy and Management (Q2)";"Business, Management and Accounting; Computer Science; Decision Sciences; Economics, Econometrics and Finance"
116;21101111783;"Smart Agricultural Technology";journal;"27723755";0,849;Q2;17;304;69;14469;513;68;7,43;47,60;Netherlands;Western Europe;"Elsevier B.V.";"2021-2023";"Agricultural and Biological Sciences (miscellaneous) (Q1); Computer Science (miscellaneous) (Q1); Artificial Intelligence (Q2)";"Agricultural and Biological Sciences; Computer Science"
117;24361;"Journal of Intelligent Information Systems";journal;"15737675, 09259902";0,835;Q2;64;96;172;4273;759;170;4,54;44,51;Netherlands;Western Europe;"Springer Netherlands";"1992-2023";"Artificial Intelligence (Q2); Computer Networks and Communications (Q2); Hardware and Architecture (Q2); Information Systems (Q2); Software (Q2)";"Computer Science"
118;21100781972;"Progress in Artificial Intelligence";journal;"21926360, 21926352";0,828;Q2;27;22;84;1212;412;84;2,73;55,09;Germany;Western Europe;"Springer Nature";"2012-2023";"Artificial Intelligence (Q2)";"Computer Science"
119;21101020112;"Big Data and Cognitive Computing";journal;"25042289";0,820;Q2;33;183;279;9997;1607;278;5,60;54,63;Switzerland;Western Europe;"Multidisciplinary Digital Publishing Institute (MDPI)";"2017-2023";"Artificial Intelligence (Q2); Computer Science Applications (Q2); Information Systems (Q2); Management Information Systems (Q2)";"Business, Management and Accounting; Computer Science"
120;12358;"International Journal of Fuzzy Systems";journal;"15622479, 21993211";0,817;Q2;60;205;586;9121;2478;575;4,14;44,49;Switzerland;Western Europe;"Springer International Publishing AG";"2004-2023";"Artificial Intelligence (Q2); Computational Theory and Mathematics (Q2); Control and Systems Engineering (Q2); Information Systems (Q2); Software (Q2); Theoretical Computer Science (Q2)";"Computer Science; Engineering; Mathematics"
121;21100868821;"Frontiers in Robotics and AI";journal;"22969144";0,809;Q2;57;258;997;12761;3696;927;3,13;49,46;Switzerland;Western Europe;"Frontiers Media SA";"2014-2023";"Artificial Intelligence (Q2); Computer Science Applications (Q2)";"Computer Science"
122;21100935201;"ACM Transactions on Cyber-Physical Systems";journal;"23789638, 2378962X";0,806;Q2;23;31;107;1641;319;100;2,55;52,94;United States;Northern America;"Association for Computing Machinery (ACM)";"2017-2023";"Control and Optimization (Q1); Artificial Intelligence (Q2); Computer Networks and Communications (Q2); Hardware and Architecture (Q2); Human-Computer Interaction (Q2)";"Computer Science; Mathematics"
123;24306;"Digital Signal Processing: A Review Journal";journal;"10954333, 10512004";0,799;Q2;90;360;941;15750;3286;935;3,54;43,75;United States;Northern America;"Elsevier Inc.";"1991-2023";"Applied Mathematics (Q2); Artificial Intelligence (Q2); Computational Theory and Mathematics (Q2); Computer Vision and Pattern Recognition (Q2); Electrical and Electronic Engineering (Q2); Signal Processing (Q2); Statistics, Probability and Uncertainty (Q2)";"Computer Science; Decision Sciences; Engineering; Mathematics"
124;21100833833;"Robotics";journal;"22186581";0,795;Q2;40;168;397;9390;1631;394;3,91;55,89;Switzerland;Western Europe;"Multidisciplinary Digital Publishing Institute (MDPI)";"2012-2023";"Mechanical Engineering (Q1); Artificial Intelligence (Q2); Control and Optimization (Q2)";"Computer Science; Engineering; Mathematics"
125;19294;"Journal of Scheduling";journal;"10946136";0,793;Q2;67;49;130;1447;306;125;1,99;29,53;United States;Northern America;"Springer New York";"1998-2023";"Engineering (miscellaneous) (Q1); Artificial Intelligence (Q2); Management Science and Operations Research (Q2); Software (Q2)";"Computer Science; Decision Sciences; Engineering"
126;21101024218;"Applied System Innovation";journal;"25715577";0,788;Q2;27;113;281;5855;1548;275;5,50;51,81;Switzerland;Western Europe;"Multidisciplinary Digital Publishing Institute (MDPI)";"2018-2023";"Industrial and Manufacturing Engineering (Q1); Applied Mathematics (Q2); Artificial Intelligence (Q2); Control and Systems Engineering (Q2); Human-Computer Interaction (Q2); Information Systems (Q2)";"Computer Science; Engineering; Mathematics"
127;24822;"Pattern Analysis and Applications";journal;"1433755X, 14337541";0,783;Q2;64;115;298;5390;1213;295;4,72;46,87;United Kingdom;Western Europe;"Springer London";"1998-2023";"Artificial Intelligence (Q2); Computer Vision and Pattern Recognition (Q2)";"Computer Science"
128;21101076317;"Intelligence-Based Medicine";journal;"26665212";0,773;Q2;11;38;48;1878;205;45;2,28;49,42;Netherlands;Western Europe;"Elsevier B.V.";"2020, 2022-2023";"Artificial Intelligence (Q2); Computer Science Applications (Q2); Health Informatics (Q2); Medicine (miscellaneous) (Q2)";"Computer Science; Medicine"
129;24774;"Knowledge Engineering Review";journal;"14698005, 02698889";0,769;Q2;71;10;58;588;177;56;4,33;58,80;United Kingdom;Western Europe;"Cambridge University Press";"1984, 1987-2023";"Artificial Intelligence (Q2); Software (Q2)";"Computer Science"
130;9500154152;"Intelligent Service Robotics";journal;"18612784, 18612776";0,764;Q2;40;51;141;1905;441;136;2,76;37,35;Germany;Western Europe;"Springer Verlag";"2008-2023";"Computational Mechanics (Q1); Engineering (miscellaneous) (Q1); Mechanical Engineering (Q1); Artificial Intelligence (Q2)";"Computer Science; Engineering"
131;24173;"Connection Science";journal;"13600494, 09540091";0,763;Q2;49;92;213;3904;881;212;4,23;42,43;United Kingdom;Western Europe;"Taylor and Francis A.S.";"1989-2023";"Artificial Intelligence (Q2); Human-Computer Interaction (Q2); Software (Q2)";"Computer Science"
132;24185;"Expert Systems";journal;"14680394, 02664720";0,761;Q2;51;359;622;16126;2648;587;4,37;44,92;United Kingdom;Western Europe;"Wiley-Blackwell Publishing Ltd";"1984-2023";"Artificial Intelligence (Q2); Computational Theory and Mathematics (Q2); Control and Systems Engineering (Q2); Theoretical Computer Science (Q2)";"Computer Science; Engineering; Mathematics"
133;21100824892;"Law, Innovation and Technology";journal;"1757997X, 17579961";0,761;Q2;23;25;50;0;160;49;3,24;0,00;United Kingdom;Western Europe;"Taylor and Francis Ltd.";"2009-2023";"Computer Science (miscellaneous) (Q1); Law (Q1); Artificial Intelligence (Q2); Biotechnology (Q2); Computer Science Applications (Q2)";"Biochemistry, Genetics and Molecular Biology; Computer Science; Social Sciences"
134;21101017244;"Drones";journal;"2504446X";0,760;Q2;43;706;654;34917;3703;647;5,43;49,46;Switzerland;Western Europe;"Multidisciplinary Digital Publishing Institute (MDPI)";"2017-2023";"Aerospace Engineering (Q1); Artificial Intelligence (Q2); Computer Science Applications (Q2); Control and Systems Engineering (Q2); Information Systems (Q2)";"Computer Science; Engineering"
135;21101174247;"AI (Switzerland)";journal;"26732688";0,759;Q2;19;54;135;4044;660;130;4,33;74,89;Switzerland;Western Europe;"Multidisciplinary Digital Publishing Institute (MDPI)";"2020-2023";"Artificial Intelligence (Q2)";"Computer Science"
136;21101062817;"Frontiers in Artificial Intelligence";journal;"26248212";0,757;Q2;32;261;591;14577;2595;564;3,77;55,85;Switzerland;Western Europe;"Frontiers Media SA";"2018-2023";"Artificial Intelligence (Q2)";"Computer Science"
137;21101061989;"Data Intelligence";journal;"2641435X, 20967004";0,754;Q2;22;49;142;1933;431;128;1,80;39,45;United States;Northern America;"China National Publications Import and Export (Group) Corporation";"2019-2023";"Library and Information Sciences (Q1); Artificial Intelligence (Q2); Computer Science Applications (Q2); Information Systems (Q2)";"Computer Science; Social Sciences"
138;21101041933;"IET Collaborative Intelligent Manufacturing";journal;"25168398";0,754;Q2;14;23;85;1170;302;80;3,38;50,87;United States;Northern America;"John Wiley &amp; Sons Inc.";"2019-2023";"Industrial and Manufacturing Engineering (Q1); Artificial Intelligence (Q2); Computer Science Applications (Q2); Hardware and Architecture (Q2)";"Computer Science; Engineering"
139;21101173094;"Qubahan Academic Journal";journal;"27098206";0,749;Q2;10;47;46;1734;252;46;5,48;36,89;Iraq;Middle East;"Qubahan Organization for Development";"2021-2023";"Education (Q1); Artificial Intelligence (Q2); Business, Management and Accounting (miscellaneous) (Q2); Computational Theory and Mathematics (Q2)";"Business, Management and Accounting; Computer Science; Social Sciences"
140;21100466219;"Journal on Data Semantics";journal;"18612040, 18612032";0,725;Q2;20;0;28;0;83;25;2,42;0,00;Switzerland;Western Europe;"Springer International Publishing AG";"2012-2021";"Artificial Intelligence (Q2); Computer Networks and Communications (Q2); Information Systems (Q2)";"Computer Science"
141;21101150734;"Journal of Artificial Intelligence and Technology";journal;"27668649";0,723;Q2;15;28;54;915;321;49;5,94;32,68;United States;Northern America;"Intelligence Science and Technology Press Inc.";"2021-2023";"Artificial Intelligence (Q2)";"Computer Science"
142;21101083109;"SN Computer Science";journal;"2662995X, 26618907";0,721;Q2;35;836;1191;32645;5228;1187;4,34;39,05;Germany;Western Europe;"Springer";"2020-2023";"Artificial Intelligence (Q2); Computational Theory and Mathematics (Q2); Computer Graphics and Computer-Aided Design (Q2); Computer Networks and Communications (Q2); Computer Science Applications (Q2); Computer Science (miscellaneous) (Q2)";"Computer Science"
143;21101078232;"Journal of Computational Social Science";journal;"24322717, 24322725";0,718;Q2;20;52;123;3230;454;123;2,44;62,12;Singapore;Asiatic Region;"Springer Nature";"2018-2023";"Artificial Intelligence (Q2); Transportation (Q2)";"Computer Science; Social Sciences"
144;21101022413;"International Journal of Information Technology (Singapore)";journal;"25112104, 25112112";0,705;Q2;34;443;808;15586;3820;791;4,80;35,18;Singapore;Asiatic Region;"Springer Science + Business Media";"2017-2023";"Applied Mathematics (Q2); Artificial Intelligence (Q2); Computational Theory and Mathematics (Q2); Computer Networks and Communications (Q2); Computer Science Applications (Q2); Electrical and Electronic Engineering (Q2); Information Systems (Q2)";"Computer Science; Engineering; Mathematics"
145;21101063730;"IET Smart Cities";journal;"26317680";0,695;Q2;16;24;75;1017;259;60;2,57;42,38;United Kingdom;Western Europe;"Institution of Engineering and Technology";"2019-2023";"Urban Studies (Q1); Artificial Intelligence (Q2); Computer Networks and Communications (Q2); Computer Science Applications (Q2); Control and Systems Engineering (Q2); Electrical and Electronic Engineering (Q2); Software (Q2)";"Computer Science; Engineering; Social Sciences"
