Rank;Sourceid;Title;Type;Issn;SJR;SJR Quartile;H index;Total Docs. (2023);Total Docs. (3years);Total Refs.;Total Cites (3years);Citable Docs. (3years);Cites / Doc. (2years);Ref. / Doc.;Country;Region;Publisher;Coverage;Categories;Areas
146;23737;"Computational Intelligence";journal;"08247935, 14678640";0,692;Q2;57;54;268;2374;886;262;3,39;43,96;United Kingdom;Western Europe;"Wiley-Blackwell Publishing Ltd";"1985-2023";"Artificial Intelligence (Q2); Computational Mathematics (Q2)";"Computer Science; Mathematics"
147;24806;"Neural Processing Letters";journal;"13704621, 1573773X";0,692;Q2;65;586;778;27290;2839;773;3,68;46,57;Netherlands;Western Europe;"Springer Netherlands";"1994-2023";"Artificial Intelligence (Q2); Computer Networks and Communications (Q2); Software (Q2); Neuroscience (miscellaneous) (Q3)";"Computer Science; Neuroscience"
148;21101048389;"CCF Transactions on Pervasive Computing and Interaction";journal;"25245228, 2524521X";0,690;Q2;13;27;85;1337;293;82;2,80;49,52;Germany;Western Europe;"Springer Verlag";"2019-2023";"Artificial Intelligence (Q2); Computer Networks and Communications (Q2); Computer Science Applications (Q2); Human-Computer Interaction (Q2)";"Computer Science"
149;21101052354;"Frontiers in Big Data";journal;"2624909X";0,686;Q2;24;128;307;6540;1058;283;2,88;51,09;Switzerland;Western Europe;"Frontiers Media SA";"2018-2023";"Artificial Intelligence (Q2); Computer Science (miscellaneous) (Q2); Information Systems (Q2)";"Computer Science"
150;21101023806;"Annals of Data Science";journal;"21985812, 21985804";0,682;Q2;27;114;165;4394;541;162;3,11;38,54;Germany;Western Europe;"Springer Science and Business Media Deutschland GmbH";"2014-2023";"Artificial Intelligence (Q2); Business, Management and Accounting (miscellaneous) (Q2); Computer Science Applications (Q2); Statistics, Probability and Uncertainty (Q2)";"Business, Management and Accounting; Computer Science; Decision Sciences"
151;11700154734;"Swarm Intelligence";journal;"19353820, 19353812";0,681;Q2;45;15;41;625;111;39;2,24;41,67;United States;Northern America;"Springer New York";"2008-2023";"Artificial Intelligence (Q2)";"Computer Science"
152;21100900308;"Intelligenza Artificiale";journal;"17248035, 22110097";0,679;Q2;7;16;42;673;85;39;2,16;42,06;Netherlands;Western Europe;"IOS Press BV";"2018-2023";"Artificial Intelligence (Q2)";"Computer Science"
153;21100199837;"Frontiers in Neurorobotics";journal;"16625218";0,676;Q2;50;233;603;9622;1943;564;2,83;41,30;Switzerland;Western Europe;"Frontiers Media SA";"2007-2023";"Artificial Intelligence (Q2); Biomedical Engineering (Q2)";"Computer Science; Engineering"
154;21101096774;"Intelligent Medicine";journal;"20969376, 26671026";0,674;Q2;10;35;49;1587;163;40;3,33;45,34;Netherlands;Western Europe;"Chinese Medical Association";"2021-2023";"Artificial Intelligence (Q2); Biomedical Engineering (Q2); Health Informatics (Q2); Medicine (miscellaneous) (Q2)";"Computer Science; Engineering; Medicine"
155;21101058018;"Journal of Physics: Complexity";journal;"2632072X";0,674;Q2;15;64;169;3261;461;169;2,72;50,95;United Kingdom;Western Europe;"IOP Publishing Ltd.";"2020-2023";"Artificial Intelligence (Q2); Computer Networks and Communications (Q2); Computer Science Applications (Q2); Information Systems (Q2)";"Computer Science"
156;21101042013;"Journal of Educational Data Mining";journal;"21572100";0,665;Q3;9;13;37;651;82;34;0,92;50,08;United States;Northern America;"International Educational Data Mining Society";"2019-2023";"Computer Science Applications (Q2); Education (Q2); Artificial Intelligence (Q3)";"Computer Science; Social Sciences"
157;28380;"Natural Language Engineering";journal;"14698110, 13513249";0,664;Q3;63;85;92;6346;414;88;4,94;74,66;United Kingdom;Western Europe;"Cambridge University Press";"1995-2023";"Linguistics and Language (Q1); Software (Q2); Artificial Intelligence (Q3)";"Computer Science; Social Sciences"
158;24358;"Journal of Heuristics";journal;"13811231, 15729397";0,650;Q3;73;21;93;848;243;91;1,78;40,38;Netherlands;Western Europe;"Springer Netherlands";"1995-2023";"Computer Networks and Communications (Q2); Control and Optimization (Q2); Information Systems (Q2); Management Science and Operations Research (Q2); Software (Q2); Artificial Intelligence (Q3)";"Computer Science; Decision Sciences; Mathematics"
159;21101017166;"KI - Kunstliche Intelligenz";journal;"16101987, 09331875";0,649;Q3;30;25;139;873;411;106;2,71;34,92;Switzerland;Western Europe;"Springer International Publishing";"2010-2023";"Artificial Intelligence (Q3)";"Computer Science"
160;14500154734;"Evolutionary Intelligence";journal;"18645917, 18645909";0,638;Q3;36;180;408;8518;1451;401;3,40;47,32;Germany;Western Europe;"Springer Verlag";"2008-2023";"Computer Vision and Pattern Recognition (Q2); Mathematics (miscellaneous) (Q2); Artificial Intelligence (Q3); Cognitive Neuroscience (Q3)";"Computer Science; Mathematics; Neuroscience"
161;21100210905;"i-Perception";journal;"20416695";0,629;Q3;37;53;193;1953;416;192;2,33;36,85;United Kingdom;Western Europe;"SAGE Publications Ltd";"2010-2023";"Ophthalmology (Q2); Artificial Intelligence (Q3); Experimental and Cognitive Psychology (Q3); Sensory Systems (Q3)";"Computer Science; Medicine; Neuroscience; Psychology"
162;21101142737;"Computational Urban Science";journal;"27306852";0,627;Q3;9;36;75;2072;275;75;3,67;57,56;Singapore;Asiatic Region;"Springer";"2021-2023";"Urban Studies (Q1); Computer Science Applications (Q2); Environmental Science (miscellaneous) (Q2); Artificial Intelligence (Q3)";"Computer Science; Environmental Science; Social Sciences"
163;21100912216;"IET Cyber-Physical Systems: Theory and Applications";journal;"23983396";0,618;Q3;19;45;81;1760;183;79;2,14;39,11;United Kingdom;Western Europe;"John Wiley &amp; Sons Inc.";"2016-2023";"Computer Networks and Communications (Q2); Computer Science Applications (Q2); Electrical and Electronic Engineering (Q2); Information Systems (Q2); Artificial Intelligence (Q3)";"Computer Science; Engineering"
164;15435;"Journal of Consciousness Studies";journal;"20512201, 13558250";0,610;Q3;74;76;215;2959;290;192;1,39;38,93;United Kingdom;Western Europe;"Imprint Academic";"1996-2023";"Philosophy (Q1); Ecology, Evolution, Behavior and Systematics (Q2); Psychology (miscellaneous) (Q2); Artificial Intelligence (Q3)";"Agricultural and Biological Sciences; Arts and Humanities; Computer Science; Psychology"
165;21101060462;"Results in Control and Optimization";journal;"26667207";0,610;Q3;12;138;99;6487;409;99;4,04;47,01;Netherlands;Western Europe;"Elsevier B.V.";"2020-2023";"Applied Mathematics (Q2); Control and Optimization (Q2); Control and Systems Engineering (Q2); Modeling and Simulation (Q2); Artificial Intelligence (Q3)";"Computer Science; Engineering; Mathematics"
166;21100790723;"Computability";journal;"22113576, 22113568";0,599;Q3;12;19;53;544;31;51;0,49;28,63;Netherlands;Western Europe;"IOS Press BV";"2012-2023";"Computational Theory and Mathematics (Q2); Computer Science Applications (Q2); Theoretical Computer Science (Q2); Artificial Intelligence (Q3)";"Computer Science; Mathematics"
167;23673;"Applied Artificial Intelligence";journal;"10876545, 08839514";0,598;Q3;63;107;340;3590;1284;340;3,66;33,55;United Kingdom;Western Europe;"Taylor and Francis Ltd.";"1987-2023";"Artificial Intelligence (Q3)";"Computer Science"
168;144945;"Networks and Spatial Economics";journal;"1566113X";0,595;Q3;59;35;108;1582;238;106;1,90;45,20;Netherlands;Western Europe;"Kluwer Academic Publishers";"2005-2023";"Computer Networks and Communications (Q2); Software (Q2); Artificial Intelligence (Q3)";"Computer Science"
169;21100935977;"International Journal of Intelligent Robotics and Applications";journal;"23665971, 2366598X";0,592;Q3;21;56;134;2893;335;127;2,88;51,66;Singapore;Asiatic Region;"Springer Singapore";"2017-2023";"Computer Science Applications (Q2); Artificial Intelligence (Q3)";"Computer Science"
170;144749;"International Journal of Advanced Robotic Systems";journal;"17298806";0,590;Q3;62;45;471;1813;1361;470;2,55;40,29;United States;Northern America;"SAGE Publications Inc.";"2004-2023";"Computer Science Applications (Q2); Software (Q2); Artificial Intelligence (Q3)";"Computer Science"
171;21101013582;"IEEE Transactions on Games";journal;"24751510, 24751502";0,589;Q3;52;115;156;2890;420;151;2,27;25,13;United States;Northern America;"Institute of Electrical and Electronics Engineers Inc.";"2018-2023";"Control and Systems Engineering (Q2); Electrical and Electronic Engineering (Q2); Software (Q2); Artificial Intelligence (Q3)";"Computer Science; Engineering"
172;21100810658;"Paladyn";journal;"20814836";0,589;Q3;26;28;74;1041;254;73;3,40;37,18;Poland;Eastern Europe;"Walter de Gruyter GmbH";"2010-2023";"Artificial Intelligence (Q3); Behavioral Neuroscience (Q3); Cognitive Neuroscience (Q3); Developmental Neuroscience (Q3); Human-Computer Interaction (Q3)";"Computer Science; Neuroscience"
173;24175;"Constraints";journal;"15729354, 13837133";0,586;Q3;48;20;32;862;50;28;1,21;43,10;Netherlands;Western Europe;"Springer Netherlands";"1996-2023";"Computational Theory and Mathematics (Q2); Discrete Mathematics and Combinatorics (Q2); Software (Q2); Artificial Intelligence (Q3)";"Computer Science; Mathematics"
174;12795;"Perception";journal;"14684233, 03010066";0,584;Q3;103;54;223;2442;358;211;1,56;45,22;United States;Northern America;"SAGE Publications Inc.";"1972-2023";"Ophthalmology (Q2); Artificial Intelligence (Q3); Experimental and Cognitive Psychology (Q3); Sensory Systems (Q3)";"Computer Science; Medicine; Neuroscience; Psychology"
175;21101063736;"IFAC Journal of Systems and Control";journal;"24686018";0,582;Q3;13;20;71;791;156;71;2,31;39,55;United Kingdom;Western Europe;"Elsevier B.V.";"2017-2023";"Computer Networks and Communications (Q2); Computer Science Applications (Q2); Control and Systems Engineering (Q2); Management Science and Operations Research (Q2); Modeling and Simulation (Q2); Artificial Intelligence (Q3)";"Computer Science; Decision Sciences; Engineering; Mathematics"
176;19900191732;"Argument and Computation";journal;"19462166, 19462174";0,579;Q3;25;7;43;367;81;41;1,72;52,43;United Kingdom;Western Europe;"IOS Press";"2010-2023";"Linguistics and Language (Q1); Computational Mathematics (Q2); Computer Science Applications (Q2); Artificial Intelligence (Q3)";"Computer Science; Mathematics; Social Sciences"
177;18078;"Robotica";journal;"02635747, 14698668";0,579;Q3;73;192;489;7292;1255;487;2,46;37,98;United Kingdom;Western Europe;"Cambridge University Press";"1983-2023";"Computational Mechanics (Q2); Computer Science Applications (Q2); Computer Vision and Pattern Recognition (Q2); Control and Optimization (Q2); Control and Systems Engineering (Q2); Mathematics (miscellaneous) (Q2); Mechanical Engineering (Q2); Modeling and Simulation (Q2); Rehabilitation (Q2); Software (Q2); Artificial Intelligence (Q3)";"Computer Science; Engineering; Mathematics; Medicine"
178;23617;"AI Communications";journal;"09217126";0,573;Q3;44;18;64;700;96;61;1,65;38,89;Netherlands;Western Europe;"IOS Press BV";"1987-2023";"Artificial Intelligence (Q3)";"Computer Science"
179;12981;"Kybernetes";journal;"0368492X";0,571;Q3;53;567;474;39825;1825;468;3,85;70,24;United Kingdom;Western Europe;"Emerald Group Publishing Ltd.";"1972-2023";"Social Sciences (miscellaneous) (Q1); Computer Science (miscellaneous) (Q2); Control and Systems Engineering (Q2); Electrical and Electronic Engineering (Q2); Engineering (miscellaneous) (Q2); Information Systems (Q2); Software (Q2); Theoretical Computer Science (Q2); Artificial Intelligence (Q3)";"Computer Science; Engineering; Mathematics; Social Sciences"
180;23635;"Adaptive Behavior";journal;"17412633, 10597123";0,562;Q3;59;47;157;3218;282;126;1,79;68,47;United Kingdom;Western Europe;"SAGE Publications Ltd";"1992-2023";"Philosophy (Q1); Artificial Intelligence (Q3); Behavioral Neuroscience (Q3); Experimental and Cognitive Psychology (Q3)";"Arts and Humanities; Computer Science; Neuroscience; Psychology"
181;21101152520;"Robotic Intelligence and Automation";journal;"27546977, 27546969";0,555;Q3;50;56;211;2112;518;209;2,25;37,71;United Kingdom;Western Europe;"Emerald Publishing";"2023";"Computer Science Applications (Q2); Control and Systems Engineering (Q2); Electrical and Electronic Engineering (Q2); Industrial and Manufacturing Engineering (Q2); Artificial Intelligence (Q3); Human-Computer Interaction (Q3)";"Computer Science; Engineering"
182;15552;"Microprocessors and Microsystems";journal;"01419331";0,549;Q3;51;165;1082;6874;3360;1079;2,82;41,66;Netherlands;Western Europe;"Elsevier B.V.";"1978-2023";"Computer Networks and Communications (Q2); Hardware and Architecture (Q2); Artificial Intelligence (Q3); Software (Q3)";"Computer Science"
183;21101072200;"IET Cyber-systems and Robotics";journal;"26316315";0,541;Q3;10;30;82;1225;195;79;1,85;40,83;United States;Northern America;"John Wiley and Sons Inc.";"2019-2023";"Computational Theory and Mathematics (Q2); Computer Networks and Communications (Q2); Hardware and Architecture (Q2); Information Systems (Q2); Artificial Intelligence (Q3); Human-Computer Interaction (Q3)";"Computer Science"
184;130113;"Cognitive Processing";journal;"16124782, 16124790";0,534;Q3;53;51;164;3518;297;161;1,70;68,98;Germany;Western Europe;"Springer Verlag";"2005-2023";"Medicine (miscellaneous) (Q2); Artificial Intelligence (Q3); Cognitive Neuroscience (Q3); Experimental and Cognitive Psychology (Q3)";"Computer Science; Medicine; Neuroscience; Psychology"
185;21101134735;"Data Science";journal;"24518484, 24518492";0,527;Q3;11;2;34;99;98;33;1,74;49,50;Netherlands;Western Europe;"IOS Press BV";"2021-2022";"Computational Mathematics (Q2); Computer Science (miscellaneous) (Q2); Information Systems (Q2); Modeling and Simulation (Q2); Statistics and Probability (Q2); Artificial Intelligence (Q3)";"Computer Science; Mathematics"
186;23678;"Artificial Intelligence for Engineering Design, Analysis and Manufacturing: AIEDAM";journal;"08900604, 14691760";0,526;Q3;58;24;102;1531;243;98;2,36;63,79;United Kingdom;Western Europe;"Cambridge University Press";"1987-2023";"Industrial and Manufacturing Engineering (Q2); Artificial Intelligence (Q3)";"Computer Science; Engineering"
187;21100821307;"Applied Computational Intelligence and Soft Computing";journal;"16879724, 16879732";0,524;Q3;22;35;106;1677;430;105;3,88;47,91;Egypt;Africa/Middle East;"Hindawi Limited";"2016-2023";"Civil and Structural Engineering (Q2); Computational Mechanics (Q2); Computer Networks and Communications (Q2); Computer Science Applications (Q2); Artificial Intelligence (Q3)";"Computer Science; Engineering"
188;24357;"Journal of Experimental and Theoretical Artificial Intelligence";journal;"13623079, 0952813X";0,511;Q3;52;107;204;5857;493;204;2,35;54,74;United Kingdom;Western Europe;"Taylor and Francis Ltd.";"1989-2023";"Artificial Intelligence (Q3); Software (Q3); Theoretical Computer Science (Q3)";"Computer Science; Mathematics"
189;96537;"Proceedings of the International Joint Conference on Neural Networks";conference and proceedings;"-";0,500;-;98;974;3397;32396;5368;3391;1,26;33,26;United States;Northern America;"Institute of Electrical and Electronics Engineers Inc.";"1992-1993, 1999-2003, 2005, 2008-2023";"Artificial Intelligence; Software";"Computer Science"
190;12409;"Multidimensional Systems and Signal Processing";journal;"15730824, 09236082";0,499;Q3;46;32;200;1337;529;200;2,68;41,78;Netherlands;Western Europe;"Springer Netherlands";"1990-2023";"Applied Mathematics (Q2); Information Systems (Q2); Artificial Intelligence (Q3); Computer Science Applications (Q3); Hardware and Architecture (Q3); Signal Processing (Q3); Software (Q3)";"Computer Science; Mathematics"
191;23629;"AI Magazine";journal;"07384602";0,486;Q3;87;51;110;1730;322;100;3,42;33,92;United States;Northern America;"John Wiley and Sons Inc.";"1984-1986, 1989-2023";"Artificial Intelligence (Q3)";"Computer Science"
192;21101022415;"Spatial Information Research";journal;"23663286, 23663294";0,484;Q3;24;71;200;2815;494;200;2,27;39,65;Singapore;Asiatic Region;"Springer Science and Business Media B.V.";"2016-2023";"Computers in Earth Sciences (Q2); Geography, Planning and Development (Q2); Artificial Intelligence (Q3); Computer Science Applications (Q3)";"Computer Science; Earth and Planetary Sciences; Social Sciences"
193;21101144505;"Data and Policy";journal;"26323249";0,479;Q3;10;38;94;2038;202;94;2,09;53,63;United Kingdom;Western Europe;"Cambridge University Press";"2020-2023";"Computer Science (miscellaneous) (Q2); Public Administration (Q2); Social Sciences (miscellaneous) (Q2); Artificial Intelligence (Q3)";"Computer Science; Social Sciences"
194;12962;"Journal of Intelligent Systems";journal;"03341860, 2191026X";0,479;Q3;31;80;309;2684;912;308;3,04;33,55;Germany;Western Europe;"Walter de Gruyter GmbH";"1991-2002, 2004-2023";"Artificial Intelligence (Q3); Information Systems (Q3); Software (Q3)";"Computer Science"
195;21101124068;"Iraqi Journal for Computer Science and Mathematics";journal;"27887421, 29580544";0,471;Q3;11;64;45;2058;196;45;5,14;32,16;Iraq;Middle East;"College of Education, Al-Iraqia University";"2020-2023";"Computer Graphics and Computer-Aided Design (Q2); Artificial Intelligence (Q3); Computational Theory and Mathematics (Q3); Computer Networks and Communications (Q3)";"Computer Science"
196;21100873335;"Journal of Control and Decision";journal;"23307714, 23307706";0,465;Q3;21;127;123;4207;245;123;1,84;33,13;United Kingdom;Western Europe;"Taylor and Francis Ltd.";"2014-2023";"Control and Systems Engineering (Q2); Artificial Intelligence (Q3); Computer Networks and Communications (Q3); Control and Optimization (Q3); Human-Computer Interaction (Q3); Information Systems (Q3); Signal Processing (Q3)";"Computer Science; Engineering; Mathematics"
197;26138;"Parallel Computing";journal;"01678191";0,460;Q3;71;33;146;1149;312;141;2,47;34,82;Netherlands;Western Europe;"Elsevier B.V.";"1984-2023";"Computer Graphics and Computer-Aided Design (Q2); Artificial Intelligence (Q3); Computer Networks and Communications (Q3); Hardware and Architecture (Q3); Software (Q3); Theoretical Computer Science (Q3)";"Computer Science; Mathematics"
198;21101044881;"International Journal of Serious Games";journal;"23848766";0,441;Q3;12;31;84;1526;150;71;1,91;49,23;Italy;Western Europe;"Serious Games Society";"2019-2023";"Computer Graphics and Computer-Aided Design (Q2); Education (Q2); Applied Mathematics (Q3); Artificial Intelligence (Q3); Human-Computer Interaction (Q3); Software (Q3)";"Computer Science; Mathematics; Social Sciences"
199;21101101298;"Advanced Control for Applications: Engineering and Industrial Systems";journal;"25780727";0,439;Q3;7;60;65;1622;94;62;1,55;27,03;United States;Northern America;"John Wiley and Sons Inc.";"2019-2023";"Artificial Intelligence (Q3); Computer Networks and Communications (Q3); Computer Science Applications (Q3); Control and Systems Engineering (Q3); Energy (miscellaneous) (Q3); Modeling and Simulation (Q3); Signal Processing (Q3)";"Computer Science; Energy; Engineering; Mathematics"
200;21101047452;"Journal of Soft Computing in Civil Engineering";journal;"25882872";0,439;Q3;15;28;84;1387;223;84;2,64;49,54;Iran;Middle East;"Pouyan Press";"2017-2024";"Architecture (Q1); Building and Construction (Q2); Civil and Structural Engineering (Q2); Artificial Intelligence (Q3); Computer Science Applications (Q3)";"Computer Science; Engineering"
201;19700175219;"Iranian Journal of Fuzzy Systems";journal;"17350654";0,433;Q3;37;70;232;2456;454;232;1,93;35,09;Iran;Middle East;"University of Sistan and Baluchestan";"2004-2023";"Information Systems and Management (Q2); Mathematics (miscellaneous) (Q2); Artificial Intelligence (Q3); Computer Science Applications (Q3)";"Computer Science; Decision Sciences; Mathematics"
202;21101092539;"Advances in Distributed Computing and Artificial Intelligence Journal";journal;"22552863";0,422;Q3;6;16;37;576;54;37;1,14;36,00;Spain;Western Europe;"University of Salamanca";"2019, 2021-2023";"Artificial Intelligence (Q3); Computer Networks and Communications (Q3); Computer Science Applications (Q3); Information Systems (Q3)";"Computer Science"
203;21101019334;"Journal of Business Analytics";journal;"2573234X, 25732358";0,420;Q3;9;18;36;1197;84;35;2,56;66,50;United Kingdom;Western Europe;"Taylor and Francis Ltd.";"2018-2023";"Industrial and Manufacturing Engineering (Q2); Information Systems and Management (Q2); Management Information Systems (Q2); Artificial Intelligence (Q3); Information Systems (Q3); Management Science and Operations Research (Q3); Statistics, Probability and Uncertainty (Q3)";"Business, Management and Accounting; Computer Science; Decision Sciences; Engineering"
204;21100970247;"International Journal of Data and Network Science";journal;"25618148, 25618156";0,418;Q3;28;200;286;9519;1725;286;6,49;47,60;Canada;Northern America;"Growing Science";"2018-2023";"Communication (Q2); Artificial Intelligence (Q3); Computer Networks and Communications (Q3); Computer Science Applications (Q3); Information Systems (Q3); Software (Q3)";"Computer Science; Social Sciences"
205;23670;"Annals of Mathematics and Artificial Intelligence";journal;"15737470, 10122443";0,411;Q3;59;84;159;3255;222;147;1,35;38,75;Netherlands;Western Europe;"Springer Netherlands";"1990-2023";"Applied Mathematics (Q3); Artificial Intelligence (Q3)";"Computer Science; Mathematics"
206;24326;"International Journal of Uncertainty, Fuzziness and Knowledge-Based Systems";journal;"02184885, 17936411";0,411;Q3;65;67;195;2411;298;186;1,44;35,99;Singapore;Asiatic Region;"World Scientific Publishing Co. Pte Ltd";"1996-2023";"Artificial Intelligence (Q3); Control and Systems Engineering (Q3); Information Systems (Q3); Software (Q3)";"Computer Science; Engineering"
207;24142;"Artificial Life";journal;"10645462, 15309185";0,406;Q3;63;28;75;1432;141;69;1,45;51,14;United States;Northern America;"MIT Press Journals";"1995, 1997-2023";"Artificial Intelligence (Q3); Biochemistry, Genetics and Molecular Biology (miscellaneous) (Q3); Ecology, Evolution, Behavior and Systematics (Q3)";"Agricultural and Biological Sciences; Biochemistry, Genetics and Molecular Biology; Computer Science"
208;12931;"Cybernetics and Systems";journal;"10876553, 01969722";0,390;Q3;47;145;198;5121;366;193;1,62;35,32;United Kingdom;Western Europe;"Taylor and Francis Ltd.";"1980-2023";"Artificial Intelligence (Q3); Information Systems (Q3); Software (Q3)";"Computer Science"
209;21100853738;"ROBOMECH Journal";journal;"21974225";0,385;Q3;19;30;87;745;149;87;1,54;24,83;Switzerland;Western Europe;"Springer International Publishing AG";"2014-2023";"Mechanical Engineering (Q2); Artificial Intelligence (Q3); Control and Optimization (Q3); Instrumentation (Q3); Modeling and Simulation (Q3)";"Computer Science; Engineering; Mathematics; Physics and Astronomy"
210;23917;"Journal of Intelligent and Fuzzy Systems";journal;"18758967, 10641246";0,378;Q3;82;1492;3774;61660;7557;3757;2,02;41,33;Netherlands;Western Europe;"IOS Press BV";"1993-2023";"Engineering (miscellaneous) (Q2); Artificial Intelligence (Q3); Statistics and Probability (Q3)";"Computer Science; Engineering; Mathematics"
211;4700152208;"International Journal of Humanoid Robotics";journal;"17936942, 02198436";0,376;Q3;42;36;82;1475;123;79;1,18;40,97;Singapore;Asiatic Region;"World Scientific Publishing Co. Pte Ltd";"2004-2023";"Artificial Intelligence (Q3); Mechanical Engineering (Q3)";"Computer Science; Engineering"
212;21100464776;"Statistics, Optimization and Information Computing";journal;"23105070, 2311004X";0,375;Q3;19;74;200;2082;276;200;1,38;28,14;United States;Northern America;"International Academic Press";"2013-2023";"Artificial Intelligence (Q3); Computer Vision and Pattern Recognition (Q3); Control and Optimization (Q3); Information Systems (Q3); Signal Processing (Q3); Statistics and Probability (Q3); Statistics, Probability and Uncertainty (Q3)";"Computer Science; Decision Sciences; Mathematics"
213;21100901206;"IAES International Journal of Artificial Intelligence";journal;"20894872, 22528938";0,365;Q3;22;206;379;7015;1028;379;2,51;34,05;Indonesia;Asiatic Region;"Institute of Advanced Engineering and Science (IAES)";"2018-2023";"Artificial Intelligence (Q3); Control and Systems Engineering (Q3); Electrical and Electronic Engineering (Q3); Information Systems and Management (Q3)";"Computer Science; Decision Sciences; Engineering"
214;130045;"Journal of Applied Biomedicine";journal;"12140287, 1214021X";0,363;Q3;38;25;63;973;122;63;2,07;38,92;Czech Republic;Eastern Europe;"University of South Bohemia in Ceske Budejovice Faculty of Health and Social Sciences";"2005-2023";"Agricultural and Biological Sciences (miscellaneous) (Q2); Pharmacology, Toxicology and Pharmaceutics (miscellaneous) (Q2); Artificial Intelligence (Q3); Biochemistry, Genetics and Molecular Biology (miscellaneous) (Q3); Biomedical Engineering (Q3); Health, Toxicology and Mutagenesis (Q3); Immunology and Microbiology (miscellaneous)  (Q3); Medicine (miscellaneous) (Q3); Neuroscience (miscellaneous) (Q4)";"Agricultural and Biological Sciences; Biochemistry, Genetics and Molecular Biology; Computer Science; Engineering; Environmental Science; Immunology and Microbiology; Medicine; Neuroscience; Pharmacology, Toxicology and Pharmaceutics"
215;21101052917;"Mathematical Foundations of Computing";journal;"25778838";0,363;Q3;6;52;74;1602;82;72;1,16;30,81;United States;Northern America;"American Institute of Mathematical Sciences";"2020-2023";"Artificial Intelligence (Q3); Computational Mathematics (Q3); Computational Theory and Mathematics (Q3); Theoretical Computer Science (Q3)";"Computer Science; Mathematics"
